### ISSUE TITLE
[Bug]: P1S Camera stream not working

### ISSUE THREAD

**Issue by nnimby848** [maziggy/bambuddy#2521]
### Product

Bambuddy

### Area

Camera / live view / timelapse

### Bug Description

I used AI to gather and format information, but the bug is real.

When opening camera view, i get a black screen from my stream, somehow this seems to resolve itself after about 20 mins, might point to a token refresh happening at that point.

Summary

On loading the camera page (/camera/{id}), the frontend camera component mounts twice in quick succession, creating two viewer sessions. The chamber-image connection to the printer completes asynchronously and gets attributed to whichever viewer trace ID was active when the connect call was issued — not whichever viewer is still attached when it completes. When the first (short-lived) viewer has already detached by the time the connection succeeds, the surviving viewer that the browser's HTTP response depends on never receives a started stream. The browser's GET /api/v1/printers/{id}/camera/stream request then hangs forever with no response (not even headers), leaving the camera view permanently black/loading.

This is reproducible on essentially every page load/reload of the camera view. Confirmed on 3 separate captures.

Environment

Bambuddy running in an LXC container on Proxmox
Printer: Bambu Lab P1S, firmware 1.08.01, chamber-image protocol (port 6000)
Browser: Firefox 152.0.4
Debug logging enabled (backend.app.api.routes.camera, backend.app.services.camera)

Evidence

Backend log pattern (repeats identically across 3 separate reloads)

16:08:21,939 INFO [camera] [ac3df5d1] Camera viewer attached to printer-1 (subscribers=1)
16:08:21,939 INFO [camera] [ac3df5d1] Starting chamber image stream for 172.20.8.81 (stream_id=1-fanout, model=P1S)
16:08:21,977 INFO [camera] [ac3df5d1] Camera viewer detached from printer-1 (subscribers=0)   <-- detaches 38ms later
16:08:22,041 INFO [camera] [7f90db3f] Camera viewer attached to printer-1 (subscribers=1)      <-- new viewer, stays attached
16:08:22,681 INFO [services.camera] [ac3df5d1] Chamber image: connected to 172.20.8.81:6000    <-- connect completes 700ms later, under the OLD (already-detached) trace ID

7f90db3f — the viewer instance the browser's still-open HTTP response is actually tied to — never gets its own "Starting chamber image stream" or "connected" log line. It sits attached with no stream ever started for it.

This exact pattern (short-lived first viewer attaches → detaches within tens of ms → second viewer attaches and persists → connect success logged under the first, now-dead, trace ID) was observed identically in three independent page loads:

15:56:09–10 (reload #1)
16:04:56 (reload #2)
16:08:21–22 (reload #3, matches HAR below)

Network-level confirmation the backend↔printer link is healthy

tcpdump on the Bambuddy host during a black-screen episode shows the printer actively pushing JPEG frame data on port 6000 in tight ~11KB bursts:

IP 172.20.8.81.6000 > 172.20.8.122.56320: Flags [P.], seq 299216534:299216579, ... length 45
IP 172.20.8.81.6000 > 172.20.8.122.56320: Flags [.], seq 45:1445, ... length 1400
IP 172.20.8.81.6000 > 172.20.8.122.56320: Flags [.], seq 1445:2845, ... length 1400
...

This rules out any printer-side or backend-to-printer connectivity issue. Frames are flowing; they're just never routed to the client that's waiting for them.

Browser HAR confirms the request never gets a response

json{
  "request": {
    "url": "http://172.20.8.122:8000/api/v1/printers/1/camera/stream?fps=15&t=...&token=...",
  },
  "response": {
    "status": 0,
    "headers": [],
    "content": { "text": "" }
  },
  "timings": {}
}

status: 0 with empty timings — the backend never sent so much as response headers for this request. The page itself gets stuck in a perpetual "loading" state as a result (Firefox requires clicking the stop button before a reload will even register).

### Expected Behavior

Expected behavior

The viewer that is still attached when the chamber-image connection completes should be the one that receives the started stream — or, if the connecting viewer has already detached, the connection should be retried/reassigned to the current active viewer(s) on the shared fan-out rather than silently stranding them.

### Steps to Reproduce

open camera view
after connecting to stream for about 10 seconds i get a black screen, with succesfull diagnostics.

For the added log files i did have to refresh the page to get browser dev console to load the actual logs.

When the page is kept open the stream recovers after about 20 mins. 

### Troubleshooting steps already taken

searched all of github for relevant info, refreshed firmware, scraped bambuddy logs ....

### Printer Model

P1S

### Bambuddy Version

0.2.4.9

### Printer Firmware Version

01.08.01.00

### Installation Method

Other

### Operating System

Linux (Ubuntu/Debian)

### Support Package (.zip) and / or relevant logs

[bambuddy-support-20260708-161309.zip](https://github.com/user-attachments/files/29805051/bambuddy-support-20260708-161309.zip)

### Screenshots

<img width="1900" height="932" alt="Image" src="https://github.com/user-attachments/assets/18fff3c3-05de-4ff3-9642-a04311b3a6a4" />

### Additional Context

<img width="1900" height="932" alt="Image" src="https://github.com/user-attachments/assets/81b240cf-33bd-403e-957f-027e2132e7f8" />

### Final checks

- [x] I searched existing (open AND closed) issues and this bug hasn't already been reported or resolved
- [x] I checked the [Troubleshooting wiki](https://wiki.bambuddy.cool/reference/troubleshooting/) and the relevant feature page for my issue
- [x] I am using the latest version of Bambuddy (or the latest daily build)
- [x] My printer is set to LAN Only mode
- [x] My printer has Developer Mode enabled
- [x] For any connection / printing / camera issue, I ran the in-app Connection Diagnostic and included the result above

**Comment by maziggy** [comment]
Thanks for one of the best-documented reports I've had — the logs, the tcpdump showing frames live on port 6000, and the HAR made this much faster to pin down.

One correction to the mechanism: the camera uses a shared fan-out (one connection to the printer per printer, not one per viewer), so the surviving viewer not getting its own "Starting/connected" line is actually by design — every viewer after the first taps the same stream, and the trace ID in the log is just logging context. The status:0 in the HAR is a mid-stream capture, not a missing response. So the connection wasn't being "stranded on a dead viewer" — but you were dead right that the double-mount churn is what triggers the bug.

What was actually going wrong, and is now fixed:

1. Late viewers joined the shared stream with no frame buffered, so the image never loaded, which made the page's stall-detector reconnect every few seconds — a self-feeding loop. New viewers are now primed with the last frame instantly.
2. On a P1S the camera port allows only one connection, and the churn could open a new socket before the old one closed. The printer then kept feeding the orphaned socket until its TCP timeout (~20 min — that's your "recovers after 20 minutes"). The new connection now waits for the old one to fully close first.
3. The frontend stall-detector now waits for two consecutive bad readings before reconnecting, so a blip during startup no longer nukes a stream that's about to work.

This will be in the next build. If it ever comes up black again, a quick ss -tn | grep :6000 during the black screen (showing more than one connection) would confirm — but this should have it. Thanks again.

Available/Fixed in branch dev and available with the next release or daily build. Please let me know if it works for you.

-----
If you find Bambuddy useful, please consider giving it a ⭐ on [GitHub](https://github.com/maziggy/bambuddy) — it helps others discover the project!

**Comment by nnimby848** [comment]
Hi,


Doesn't seem resolved for me. Tested both with the daily from the 10th and the one from the 13rd.

I included the log again from the backend as well as the browser HAR.


Thanks for the quick response

[browser HAR.txt](https://github.com/user-attachments/files/29999341/browser.HAR.txt)
[backend.txt](https://github.com/user-attachments/files/29999340/backend.txt)

**Comment by nnimby848** [comment]
I think you posted a response to the wrong bug report ;-)

**Comment by maziggy** [comment]
Yup, need a coffee ;)

**Comment by maziggy** [comment]
Available/Fixed in branch dev and available with the next release or daily build. Please let me know if it works for you.

-----
If you find Bambuddy useful, please consider giving it a ⭐ on [GitHub](https://github.com/maziggy/bambuddy) — it helps others discover the project!

**Comment by kreeger** [comment]
I was hoping this would fix my issue but alas maybe mine is different. Same setup (P1S), same issue (camera feed not working). My A1 seems fine. Doctor says:

![image](https://github.com/user-attachments/assets/e9370e53-6fde-4fde-b870-864b1d0d0127)

>Printer is not reachable. Check the IP address, network connection, and that the printer is powered on.

The printer is definitely reachable since i can send print jobs to it (and see the rest of the realtime stats on there) no problem. Wondering what other information i can provide to help troubleshoot this.
