### ISSUE TITLE
[Bug]: Docker bridge mode: Virtual Printer identity uses container IP instead of host IP, preventing uploads from Bambu Studio

### ISSUE THREAD

**Issue by odnarod** [maziggy/bambuddy#2605]
### Product

Bambuddy

### Area

Virtual Printer (VP)

### Bug Description

When running Bambuddy Virtual Printer in Docker bridge mode, the Virtual Printer uses the container IP (172.17.0.10) instead of the Docker host IP (e.g. 192.168.1.11) as its identity/address.

The Virtual Printer can be added manually by IP and partially works:
- Detect works
- MQTT connection succeeds
- Status updates work
- Camera proxy works

However, sending a print job from Bambu Studio always fails at around 10% with "Failed to send".

The issue does not occur when running Bambuddy with network_mode: host.

Additional observation:
The generated Virtual Printer TLS certificate contains the container IP (172.17.0.10) instead of the host IP.

VIRTUAL_PRINTER_PASV_ADDRESS correctly changes the FTP PASV address, but does not affect the Virtual Printer identity/certificate/bind address.

### Expected Behavior

In Docker bridge mode, the Virtual Printer should use a configurable external/host IP address instead of the internal Docker bridge IP.

The configured host IP should be used consistently for:
- Virtual Printer advertised address
- TLS certificate SAN
- Virtual Printer bind/identity information

Bambu Studio should be able to upload print jobs successfully when the printer is added manually by IP.

I would have expected an ENV variable to manually define a "network interface override" option, similar to VIRTUAL_PRINTER_PASV_ADDRESS.

### Steps to Reproduce

1. Deploy Bambuddy using Docker bridge mode.
2. Configure VIRTUAL_PRINTER_PASV_ADDRESS with the Docker host IP, for example:

   VIRTUAL_PRINTER_PASV_ADDRESS=192.168.1.11

3. Expose the documented Virtual Printer ports:
   - 3000
   - 3002
   - 8883
   - 990
   - 6000
   - 2024-2026
   - 50000-50009

4. Start Bambuddy.

5. Create a Virtual Printer.

6. Add the Virtual Printer manually in Bambu Studio using the Docker host IP.

7. Try to send a print job.

Result:
The upload fails at approximately 10% with "Failed to send".

### Troubleshooting steps already taken

- Verified that the same Virtual Printer configuration works with network_mode: host.
- Verified that VIRTUAL_PRINTER_PASV_ADDRESS is applied correctly:

  "FTP PASV address override: 192.168.1.11" in logs

- Verified that no FTP data connection is attempted during the failed upload:
  - no connection to port 990
  - no connection to passive FTP ports 50000-50009

- Captured network traffic with tcpdump:
  - Connection to port 3002 succeeds.
  - Detect request/response succeeds.
  - Connection is closed before any upload-related connection starts.

- Checked Bambuddy logs during the upload attempt:
  - Detect works.
  - MQTT authentication works.
  - Status updates work.
  - No upload/FTP related activity is logged.

- Checked the Virtual Printer settings:
  - Network Interface Override only shows the Docker interface (172.17.0.10).
  - The Docker host interface (192.168.1.11) is not available.

- Checked the generated Virtual Printer certificate:
  - SAN contains 172.17.0.10 instead of the Docker host IP.

### Printer Model

P1S

### Bambuddy Version

0.2.4.9

### Printer Firmware Version

01.07.00.00

### Installation Method

Docker

### Operating System

Docker

### Support Package (.zip) and / or relevant logs

During connect and trying to send:

Bambuddy logs:
```
INFO:     client:49783 - "POST /api/v1/support/debug-logging HTTP/1.1" 200 OK

2026-07-19 00:15:50,079 DEBUG [backend.app.main] [-] Recorded 3 printer sensor history entries

2026-07-19 00:15:51,575 DEBUG [backend.app.services.bambu_mqtt] [-] [01P00A440801152] Received command response: push_status

2026-07-19 00:15:51,576 DEBUG [backend.app.services.bambu_mqtt] [-] [01P00A440801152] wifi_signal received: -59dBm

2026-07-19 00:15:52,120 DEBUG [backend.app.services.virtual_printer.ssdp_server] [a33be860] Sent SSDP NOTIFY for Bambuddy - P1S (Location=172.17.0.10, USN=01P00A391800001, bind=172.17.0.10)

2026-07-19 00:15:53,602 DEBUG [backend.app.services.bambu_mqtt] [-] [01P00A440801152] Received command response: push_status

2026-07-19 00:15:53,602 DEBUG [backend.app.services.bambu_mqtt] [-] [01P00A440801152] wifi_signal received: -62dBm

2026-07-19 00:15:57,647 DEBUG [backend.app.services.bambu_mqtt] [-] [01P00A440801152] Received command response: push_status

2026-07-19 00:15:57,648 DEBUG [backend.app.services.bambu_mqtt] [-] [01P00A440801152] wifi_signal received: -61dBm

2026-07-19 00:16:04,868 INFO [backend.app.services.virtual_printer.bind_server] [a33be860] Bind server: client connected from client:59580

2026-07-19 00:16:04,871 INFO [backend.app.services.virtual_printer.bind_server] [a33be860] Bind server: received from client:59580: {'login': {'command': 'detect', 'sequence_id': '20006'}}

2026-07-19 00:16:04,872 INFO [backend.app.services.virtual_printer.bind_server] [a33be860] Bind server: sent detect response to client:59580 (serial=01P00A391800001)

2026-07-19 00:16:05,760 DEBUG [backend.app.services.bambu_mqtt] [-] [01P00A440801152] Received command response: push_status

2026-07-19 00:16:05,761 DEBUG [backend.app.services.bambu_mqtt] [-] [01P00A440801152] wifi_signal received: -60dBm

2026-07-19 00:16:05,879 DEBUG [backend.app.services.virtual_printer.bind_server] [a33be860] Bind server: client client:59580 disconnected

2026-07-19 00:16:06,098 INFO [backend.app.services.virtual_printer.mqtt_server] [a33be860] [Bambuddy - P1S] MQTT TLS connection from ('client', 59582) - cipher=('TLS_AES_256_GCM_SHA384', 'TLSv1.3', 256), version=TLSv1.3

2026-07-19 00:16:06,098 INFO [backend.app.services.virtual_printer.mqtt_server] [a33be860] [Bambuddy - P1S] MQTT client connected: client:59582

2026-07-19 00:16:06,101 INFO [backend.app.services.virtual_printer.mqtt_server] [a33be860] [Bambuddy - P1S] MQTT client authenticated successfully

2026-07-19 00:16:06,104 INFO [backend.app.services.virtual_printer.mqtt_server] [a33be860] [Bambuddy - P1S] MQTT client client:59582 authenticated (negotiated keepalive=60s, idle disconnect disabled)

2026-07-19 00:16:06,111 INFO [backend.app.services.virtual_printer.mqtt_server] [a33be860] [Bambuddy - P1S] MQTT subscribe: device/01P00A391800001/report QoS=0

2026-07-19 00:16:06,211 INFO [backend.app.services.virtual_printer.mqtt_server] [a33be860] MQTT publish to device/01P00A391800001/request: {"pushing":{"command":"pushall","push_target":1,"sequence_id":"20045","version":1}}...

2026-07-19 00:16:06,212 INFO [backend.app.services.virtual_printer.mqtt_server] [a33be860] MQTT pushing command: pushall

2026-07-19 00:16:06,212 INFO [backend.app.services.virtual_printer.mqtt_server] [a33be860] Sending status report in response to pushall

2026-07-19 00:16:06,218 INFO [backend.app.services.virtual_printer.mqtt_server] [a33be860] MQTT publish to device/01P00A391800001/request: {"info":{"command":"get_version","sequence_id":"20046"}}...

2026-07-19 00:16:06,218 INFO [backend.app.services.virtual_printer.mqtt_server] [a33be860] MQTT info command: get_version

2026-07-19 00:16:06,219 INFO [backend.app.services.virtual_printer.mqtt_server] [a33be860] Sent version response (product_name=P1S)

2026-07-19 00:16:06,219 INFO [backend.app.services.virtual_printer.mqtt_server] [a33be860] MQTT publish to device/01P00A391800001/request: {"info":{"command":"get_version","sequence_id":"20047"}}...

2026-07-19 00:16:06,220 INFO [backend.app.services.virtual_printer.mqtt_server] [a33be860] MQTT info command: get_version

2026-07-19 00:16:06,222 INFO [backend.app.services.virtual_printer.mqtt_server] [a33be860] Sent version response (product_name=P1S)

2026-07-19 00:16:07,786 DEBUG [backend.app.services.bambu_mqtt] [-] [01P00A440801152] Received command response: push_status

2026-07-19 00:16:07,788 DEBUG [backend.app.services.bambu_mqtt] [-] [01P00A440801152] wifi_signal received: -61dBm
```

TCPdump on docker host:
```
$ sudo tcpdump -n -i any port 3000 or port 3002 or port 2024 or port 2025 or port 2026 or port 990 or portrange 50000-50009
tcpdump: data link type LINUX_SLL2
tcpdump: verbose output suppressed, use -v[v]... for full protocol decode
listening on any, link-type LINUX_SLL2 (Linux cooked v2), snapshot length 262144 bytes

00:16:04.848999 ens3  In  IP client.59580 > docker_host.3002: Flags [S], seq 2145297411, win 64240, options [mss 1460,nop,wscale 8,nop,nop,sackOK], length 0
00:16:04.849155 docker0 Out IP client.59580 > 172.17.0.10.3002: Flags [S], seq 2145297411, win 64240, options [mss 1460,nop,wscale 8,nop,nop,sackOK], length 0
00:16:04.849167 veth13ce573 Out IP client.59580 > 172.17.0.10.3002: Flags [S], seq 2145297411, win 64240, options [mss 1460,nop,wscale 8,nop,nop,sackOK], length 0
00:16:04.849215 veth13ce573 P   IP 172.17.0.10.3002 > client.59580: Flags [S.], seq 28697734, ack 2145297412, win 64240, options [mss 1460,nop,nop,sackOK,nop,wscale 7], length 0
00:16:04.849215 docker0 In  IP 172.17.0.10.3002 > client.59580: Flags [S.], seq 28697734, ack 2145297412, win 64240, options [mss 1460,nop,nop,sackOK,nop,wscale 7], length 0
00:16:04.849309 ens3  Out IP docker_host.3002 > client.59580: Flags [S.], seq 28697734, ack 2145297412, win 64240, options [mss 1460,nop,nop,sackOK,nop,wscale 7], length 0
00:16:04.853456 ens3  In  IP client.59580 > docker_host.3002: Flags [.], ack 1, win 513, length 0
00:16:04.853506 docker0 Out IP client.59580 > 172.17.0.10.3002: Flags [.], ack 1, win 513, length 0
00:16:04.853515 veth13ce573 Out IP client.59580 > 172.17.0.10.3002: Flags [.], ack 1, win 513, length 0
00:16:04.855975 ens3  In  IP client.59580 > docker_host.3002: Flags [P.], seq 1:294, ack 1, win 513, length 293
00:16:04.856023 docker0 Out IP client.59580 > 172.17.0.10.3002: Flags [P.], seq 1:294, ack 1, win 513, length 293
00:16:04.856033 veth13ce573 Out IP client.59580 > 172.17.0.10.3002: Flags [P.], seq 1:294, ack 1, win 513, length 293
00:16:04.856091 veth13ce573 P   IP 172.17.0.10.3002 > client.59580: Flags [.], ack 294, win 501, length 0
00:16:04.856091 docker0 In  IP 172.17.0.10.3002 > client.59580: Flags [.], ack 294, win 501, length 0
00:16:04.856127 ens3  Out IP docker_host.3002 > client.59580: Flags [.], ack 294, win 501, length 0
00:16:04.860313 veth13ce573 P   IP 172.17.0.10.3002 > client.59580: Flags [P.], seq 1:2175, ack 294, win 501, length 2174
00:16:04.860313 docker0 In  IP 172.17.0.10.3002 > client.59580: Flags [P.], seq 1:2175, ack 294, win 501, length 2174
00:16:04.860420 ens3  Out IP docker_host.3002 > client.59580: Flags [P.], seq 1:2175, ack 294, win 501, length 2174
00:16:04.863510 ens3  In  IP client.59580 > docker_host.3002: Flags [.], ack 2175, win 513, length 0
00:16:04.863559 docker0 Out IP client.59580 > 172.17.0.10.3002: Flags [.], ack 2175, win 513, length 0
00:16:04.863569 veth13ce573 Out IP client.59580 > 172.17.0.10.3002: Flags [.], ack 2175, win 513, length 0
00:16:04.867002 ens3  In  IP client.59580 > docker_host.3002: Flags [P.], seq 294:374, ack 2175, win 513, length 80
00:16:04.867049 docker0 Out IP client.59580 > 172.17.0.10.3002: Flags [P.], seq 294:374, ack 2175, win 513, length 80
00:16:04.867058 veth13ce573 Out IP client.59580 > 172.17.0.10.3002: Flags [P.], seq 294:374, ack 2175, win 513, length 80
00:16:04.868113 veth13ce573 P   IP 172.17.0.10.3002 > client.59580: Flags [P.], seq 2175:2685, ack 374, win 501, length 510
00:16:04.868113 docker0 In  IP 172.17.0.10.3002 > client.59580: Flags [P.], seq 2175:2685, ack 374, win 501, length 510
00:16:04.868173 ens3  Out IP docker_host.3002 > client.59580: Flags [P.], seq 2175:2685, ack 374, win 501, length 510
00:16:04.871084 ens3  In  IP client.59580 > docker_host.3002: Flags [P.], seq 374:454, ack 2685, win 511, length 80
00:16:04.871134 docker0 Out IP client.59580 > 172.17.0.10.3002: Flags [P.], seq 374:454, ack 2685, win 511, length 80
00:16:04.871144 veth13ce573 Out IP client.59580 > 172.17.0.10.3002: Flags [P.], seq 374:454, ack 2685, win 511, length 80
00:16:04.872449 veth13ce573 P   IP 172.17.0.10.3002 > client.59580: Flags [P.], seq 2685:2889, ack 454, win 501, length 204
00:16:04.872449 docker0 In  IP 172.17.0.10.3002 > client.59580: Flags [P.], seq 2685:2889, ack 454, win 501, length 204
00:16:04.872520 ens3  Out IP docker_host.3002 > client.59580: Flags [P.], seq 2685:2889, ack 454, win 501, length 204
00:16:04.873312 veth13ce573 P   IP 172.17.0.10.3002 > client.59580: Flags [P.], seq 2889:2913, ack 454, win 501, length 24
00:16:04.873312 docker0 In  IP 172.17.0.10.3002 > client.59580: Flags [P.], seq 2889:2913, ack 454, win 501, length 24
00:16:04.873362 ens3  Out IP docker_host.3002 > client.59580: Flags [P.], seq 2889:2913, ack 454, win 501, length 24
00:16:04.876396 ens3  In  IP client.59580 > docker_host.3002: Flags [.], ack 2913, win 510, length 0
00:16:04.876445 docker0 Out IP client.59580 > 172.17.0.10.3002: Flags [.], ack 2913, win 510, length 0
00:16:04.876455 veth13ce573 Out IP client.59580 > 172.17.0.10.3002: Flags [.], ack 2913, win 510, length 0
00:16:05.878738 ens3  In  IP client.59580 > docker_host.3002: Flags [P.], seq 454:478, ack 2913, win 510, length 24
00:16:05.878814 docker0 Out IP client.59580 > 172.17.0.10.3002: Flags [P.], seq 454:478, ack 2913, win 510, length 24
00:16:05.878828 veth13ce573 Out IP client.59580 > 172.17.0.10.3002: Flags [P.], seq 454:478, ack 2913, win 510, length 24
00:16:05.879572 veth13ce573 P   IP 172.17.0.10.3002 > client.59580: Flags [F.], seq 2913, ack 478, win 501, length 0
00:16:05.879572 docker0 In  IP 172.17.0.10.3002 > client.59580: Flags [F.], seq 2913, ack 478, win 501, length 0
00:16:05.879657 ens3  Out IP docker_host.3002 > client.59580: Flags [F.], seq 2913, ack 478, win 501, length 0
00:16:05.879712 ens3  In  IP client.59580 > docker_host.3002: Flags [R.], seq 478, ack 2913, win 0, length 0
00:16:05.879769 docker0 Out IP client.59580 > 172.17.0.10.3002: Flags [R.], seq 478, ack 2913, win 0, length 0
00:16:05.879780 veth13ce573 Out IP client.59580 > 172.17.0.10.3002: Flags [R.], seq 478, ack 2913, win 0, length 0

```

The capture shows that the connection to the Virtual Printer bind server on port 3002 succeeds through Docker NAT.

No subsequent connections to the FTP control port (990) or passive FTP ports (50000-50009) are initiated. The session is closed after the bind communication.

### Final checks

- [x] I searched existing (open AND closed) issues and this bug hasn't already been reported or resolved
- [x] I checked the [Troubleshooting wiki](https://wiki.bambuddy.cool/reference/troubleshooting/) and the relevant feature page for my issue
- [x] I am using the latest version of Bambuddy (or the latest daily build)
- [x] My printer is set to LAN Only mode
- [x] My printer has Developer Mode enabled
- [x] For any connection / printing / camera issue, I ran the in-app Connection Diagnostic and included the result above

**Comment by nickbp** [comment]
The [docs](https://wiki.bambuddy.cool/features/virtual-printer/#docker-linux) say to use host networking, and your issue mentions that things work with host networking as well. Any reason you can't use host networking as directed?

**Comment by odnarod** [comment]
Host networking does work as a workaround, but bridge mode is also documented as a supported deployment option. According to the documentation, the only expected limitation is that SSDP discovery isn't available and the virtual printer has to be added manually by IP.
I'm perfectly happy with that trade-off, as I prefer bridge mode for the additional isolation and easier port management.
Since the documentation describes bridge mode as supported, I was hoping to understand why file uploads don't work in my setup, or whether there's another bridge-mode limitation that I'm not aware of.

**Comment by maziggy** [comment]
Thanks — the tcpdump was the key. I think I can explain the pattern, and it lines up with why most bridge-mode users don't hit this.

Everything that works (detect, MQTT, status, camera) is client-initiated: Studio connects to your host IP on a published port and Docker NATs it into the container. Uploads are the one flow where the printer tells the client where to connect — and it hands Studio the container IP 172.17.0.10 as the FTP target. That address only exists inside Docker's default bridge (docker0) NAT; your LAN client has no route to it, so the FTP connection never leaves the machine. That's exactly why you see zero traffic on 990 / the passive ports.

VIRTUAL_PRINTER_PASV_ADDRESS doesn't help here because Studio never reaches the FTP control connection to begin with — it's already aimed at an unreachable IP.

172.17.0.10 is the signature of Docker's default bridge network. Most people running the VP in "bridge" successfully are actually on macvlan/ipvlan, where the container gets a real, LAN-routable IP — so the advertised container IP just works.

Two things would let me confirm this and build the right fix:

1. The networking part of your setup — the networks: section of your docker-compose.yml (or your docker run --network ...). If it's the plain default bridge, that's the whole story.
2. A support package: enable debug logging, then generate it from the System page in Bambuddy (https://wiki.bambuddy.cool/features/system-info/?h=debug#enable-debug-logging). It captures your VP config and network details so I don't have to piece it together from the logs.

If switching to macvlan is an option for you, that would also resolve it today, as a data point — but the fix I have in mind is to let the VP advertise your host IP as the FTP target while still binding inside the container, so default-bridge NAT works out of the box.

**Comment by odnarod** [comment]
Thanks for the explanation - that makes perfect sense and matches what I'm seeing.

I could switch to macvlan as a workaround, but I'd actually prefer to keep Bambuddy on the default bridge network. Most of my services run there behind Caddy and Authentik, and using macvlan would make that setup more complicated since the container would no longer be directly reachable from the other Docker services.

Your proposed fix (advertising the host IP while still binding inside the container) sounds like the ideal solution to me, as it would allow bridge mode to work without introducing those networking trade-offs.

docker-compose.yml
```
services:
  bambuddy:
    image: ghcr.io/maziggy/bambuddy:0.2.4.9
    container_name: bambuddy_v0.2.4.9
    cap_add:
      - NET_BIND_SERVICE
    network_mode: bridge
    ports:
     - "8001:8000"
     - "3000:3000"
     - "3002:3002"
     - "8883:8883"
     - "990:990"
     - "6000:6000"
     - "322:322"
     - "2024-2026:2024-2026"
     - "50000-50009:50000-50009"
    volumes:
      - [...]/bambuddy/data:/app/data
      - [...]/bambuddy/logs:/app/logs
    environment:
      - TZ=Europe/Berlin
      - VIRTUAL_PRINTER_PASV_ADDRESS=<docker_host>

    restart: unless-stopped
```

[bambuddy-support.zip](https://github.com/user-attachments/files/30161922/bambuddy-support.zip)

**Comment by maziggy** [comment]
Thanks for confirming — and the tcpdump made this crisp. This turns out to be a fundamental limitation of Docker's default bridge (docker0 NAT), not a config gap we can close cleanly.

The flows that work (detect, MQTT, status, camera) are all client-initiated: Studio dials your host IP and Docker NATs it inward. The upload is the one flow where the printer tells Studio which IP to connect to for FTP — and it can only report an IP it actually knows. Inside a default-bridge container the only address that exists is 172.17.0.10; there is no way for the container to discover the host's LAN IP (192.168.1.11) on its own. So it advertises the container IP, your LAN client has no route to it, and the FTP connection never leaves the machine — exactly the "closed right after detect, nothing on 990" you captured.

VIRTUAL_PRINTER_PASV_ADDRESS only overrides the FTP passive-data address; it can't change the identity the printer advertises, and Studio never reaches the FTP stage to use it.

The two setups that give the VP a real, LAN-routable identity both work and you've already confirmed one:

- network_mode: host (simplest, recommended)
- macvlan — the container gets its own real LAN IP, so it stays reachable from your other Docker services while also being routable for uploads

Since you'd prefer to keep Bambuddy on the default bridge behind Caddy/Authentik, macvlan is the closest fit — it keeps a routable identity without moving to host networking. I'm going to document default-bridge as unsupported for uploads so this is clear up front. Appreciate the thorough report.

-----
If you find Bambuddy useful, please consider giving it a ⭐ on [GitHub](https://github.com/maziggy/bambuddy) — it helps others discover the project!

**Comment by odnarod** [comment]
Thanks for the detailed explanation - that makes perfect sense now.
I had assumed `VIRTUAL_PRINTER_PASV_ADDRESS` would also influence the advertised printer address, but now I understand it only affects FTP passive mode, which is never reached in this case.
macvlan sounds like a reasonable workaround for now. The only downside for my setup is that if I want to expose Bambuddy through Caddy + Authentik, containers on a macvlan network are generally isolated from the default bridge network unless additional routing is configured.

As a possible enhancement, would it make sense to allow overriding the IP address the virtual printer advertises to clients via an environment variable (similar to `VIRTUAL_PRINTER_PASV_ADDRESS`)? I'd be perfectly happy to configure my host's LAN IP manually if that made the default bridge network work for uploads.

In any way, thanks again for the quick investigation and the clear explanation.

**Comment by dfrysinger** [comment]
I independently reproduced this with Docker bridge networking and validated a manual advertised-address override in production. Keeping listeners on `0.0.0.0` while advertising the Docker host’s LAN IP fixes both proxy-mode MQTT IP rewriting and server-mode `net.info[].ip`; uploads then complete normally.

Would you be open to reopening and assigning this issue if I submit a focused implementation with tests and documentation? I propose an explicit configured advertised address—no unreliable host-IP autodetection—with existing bind/interface behavior preserved as the default.

**Comment by maziggy** [comment]
Thanks for reproducing it and validating a fix in production — that's genuinely useful, and I don't doubt that keeping listeners on 0.0.0.0 while advertising the host IP makes uploads complete on default bridge.

The reason I'm holding off on an env-var override isn't the topology, it's where the advertised address sits in the VP. It isn't a single global value: it's resolved per virtual printer (bind_ip / remote_interface_ip), and that one value feeds several flows at once — the SSDP/detect identity, the TLS cert SAN, and in proxy mode the net.info[*].ip encoding, which is deliberately subnet-matched to each printer's target and auto-resolves the host interface when the listener is 0.0.0.0. A single global VIRTUAL_PRINTER_ADVERTISE_ADDRESS would sit on top of all of that and force every VP to announce the same host IP — breaking multi-VP setups and colliding with the proxy-mode rewriting rather than composing with it. So it fixes one case (default bridge, single VP) while putting the more common ones at risk, and I can't ship a knob that trades one for the other.

The honest limitation is docker0 NAT: the container has no route it can advertise, and the two setups that give the VP a real routable identity — host networking and macvlan — already work. That's why I'm keeping default bridge documented as unsupported for uploads rather than papering over it.

If there's ever a clean per-VP decoupling — advertised address as a per-printer field, listeners staying on 0.0.0.0, no host autodetection — that passes the full VP surface (server + proxy + multi-VP + Tailscale + SSDP + cert SAN), I'm glad to look. Just not as a global env var. Appreciate the report either way.

**Comment by Silcet** [comment]
This issue did it for me. I was stubborn about trying to get the bridge mode working instead of host mode, and setting up macvlan did it for me. I think it is important to put this in the documentation so other people don't get stuck like me. I'd be happy to try and make a PR for updating the documentation. Does it make sense, or do you already have it @maziggy ?

**Comment by maziggy** [comment]
@Silcet Yes, very appreciated!
